{
  "$schema": "https://json-schema.org/draft/2020-12/schema",
  "$id": "sriiverse.knowledge.document.schema.json",
  "title": "KnowledgeDocument",
  "description": "Universal envelope for every SRIIVERSE knowledge document.",
  "type": "object",
  "required": [
    "id",
    "version",
    "tags",
    "category",
    "metadata",
    "content"
  ],
  "additionalProperties": true,
  "properties": {
    "id": {
      "type": "string",
      "minLength": 1,
      "pattern": "^[a-z0-9][a-z0-9._-]*$"
    },
    "version": {
      "type": "string",
      "minLength": 1
    },
    "tags": {
      "type": "array",
      "items": {
        "type": "string"
      },
      "minItems": 0
    },
    "category": {
      "type": "string",
      "minLength": 1
    },
    "metadata": {
      "type": "object",
      "properties": {
        "author": {
          "type": "string"
        },
        "confidence": {
          "type": "string",
          "enum": [
            "documented",
            "inferred",
            "draft"
          ]
        },
        "source": {
          "type": "string"
        },
        "createdAt": {
          "type": "string"
        },
        "updatedAt": {
          "type": "string"
        }
      }
    },
    "embedding": {
      "type": "object",
      "properties": {
        "status": {
          "type": "string",
          "enum": [
            "none",
            "pending",
            "ready",
            "stale"
          ]
        },
        "model": {
          "type": [
            "string",
            "null"
          ]
        },
        "dims": {
          "type": [
            "number",
            "null"
          ]
        },
        "vector": {
          "type": [
            "array",
            "null"
          ],
          "items": {
            "type": "number"
          }
        },
        "updatedAt": {
          "type": [
            "string",
            "null"
          ]
        }
      }
    },
    "content": {
      "type": "object"
    },
    "relationships": {
      "type": "array",
      "description": "Directed edges to related knowledge documents (knowledge graph).",
      "items": {
        "type": "object",
        "required": ["to"],
        "properties": {
          "to": {
            "type": "string",
            "minLength": 1,
            "description": "Target document id"
          },
          "type": {
            "type": "string",
            "description": "Edge type / predicate"
          },
          "weight": {
            "type": "number"
          },
          "label": {
            "type": "string"
          }
        }
      }
    }
  }
}