{
  "id": "resume.journey.v1",
  "version": "1.0.0",
  "category": "resume",
  "tags": [
    "journey",
    "timeline",
    "background"
  ],
  "metadata": {
    "author": "sriiverse",
    "confidence": "documented",
    "source": "portfolio-journey",
    "graphLabel": "Resume Journey"
  },
  "content": {
    "entries": [
      {
        "label": "Origin",
        "detail": "First commit — curiosity about how software works under the interface."
      },
      {
        "label": "Language",
        "detail": "Adopted Python as the primary language."
      },
      {
        "label": "Ship",
        "detail": "Three live AI products in production."
      }
    ]
  },
  "relationships": [
    {
      "to": "identity.core.v1",
      "type": "supports",
      "weight": 1.3
    },
    {
      "to": "projects.queryforge.overview.v1",
      "type": "includes_project",
      "weight": 1.1,
      "label": "QueryForge"
    }
  ]
}
